<?xml version="1.0" encoding="UTF-8"?>
<tns:Karsilasma xmlns:tns="http://example.org/FootballXMLSchema" xmlns:xsi="http://www.w3.org/2001/XMLSchema-instance" xsi:schemaLocation="http://example.org/FootballXMLSchema FootballXMLSchema.xsd ">
  <HaftaNo>1</HaftaNo>
  <EvSahibiTak覺m>
    <TakimKodu>1</TakimKodu>
    <TakimAdi>TakimAdi</TakimAdi>
    <Galibiyet>0</Galibiyet>
    <Beraberlik>0</Beraberlik>
    <Maglubiyet>0</Maglubiyet>
    <AtilanGol>0</AtilanGol>
    <YenilenGol>0</YenilenGol>
    <Futbolcular>
      <TakimKodu>1</TakimKodu>
      <FormaNumarasi>1</FormaNumarasi>
      <AdSoyad>AdSoyad</AdSoyad>
      <GolSayisi>1</GolSayisi>
    </Futbolcular>
    <Futbolcular>
      <TakimKodu>1</TakimKodu>
      <FormaNumarasi>1</FormaNumarasi>
      <AdSoyad>AdSoyad</AdSoyad>
      <GolSayisi>0</GolSayisi>
    </Futbolcular>
    <Futbolcular>
      <TakimKodu>1</TakimKodu>
      <FormaNumarasi>0</FormaNumarasi>
      <AdSoyad>AdSoyad</AdSoyad>
      <GolSayisi>0</GolSayisi>
    </Futbolcular>
    <Futbolcular>
      <TakimKodu>0</TakimKodu>
      <FormaNumarasi>0</FormaNumarasi>
      <AdSoyad>AdSoyad</AdSoyad>
      <GolSayisi>0</GolSayisi>
    </Futbolcular>
    <Futbolcular>
      <TakimKodu>0</TakimKodu>
      <FormaNumarasi>0</FormaNumarasi>
      <AdSoyad>AdSoyad</AdSoyad>
      <GolSayisi>0</GolSayisi>
    </Futbolcular>
    <Futbolcular>
      <TakimKodu>0</TakimKodu>
      <FormaNumarasi>0</FormaNumarasi>
      <AdSoyad>AdSoyad</AdSoyad>
      <GolSayisi>0</GolSayisi>
    </Futbolcular>
    <Futbolcular>
      <TakimKodu>0</TakimKodu>
      <FormaNumarasi>0</FormaNumarasi>
      <AdSoyad>AdSoyad</AdSoyad>
      <GolSayisi>0</GolSayisi>
    </Futbolcular>
    <Futbolcular>
      <TakimKodu>0</TakimKodu>
      <FormaNumarasi>0</FormaNumarasi>
      <AdSoyad>AdSoyad</AdSoyad>
      <GolSayisi>0</GolSayisi>
    </Futbolcular>
    <Futbolcular>
      <TakimKodu>0</TakimKodu>
      <FormaNumarasi>0</FormaNumarasi>
      <AdSoyad>AdSoyad</AdSoyad>
      <GolSayisi>0</GolSayisi>
    </Futbolcular>
    <Futbolcular>
      <TakimKodu>0</TakimKodu>
      <FormaNumarasi>0</FormaNumarasi>
      <AdSoyad>AdSoyad</AdSoyad>
      <GolSayisi>0</GolSayisi>
    </Futbolcular>
    <Futbolcular>
      <TakimKodu>0</TakimKodu>
      <FormaNumarasi>0</FormaNumarasi>
      <AdSoyad>AdSoyad</AdSoyad>
      <GolSayisi>0</GolSayisi>
    </Futbolcular>
  </EvSahibiTak覺m>
  <MisafirTak覺m>
    <TakimKodu>0</TakimKodu>
    <TakimAdi>TakimAdi</TakimAdi>
    <Galibiyet>0</Galibiyet>
    <Beraberlik>0</Beraberlik>
    <Maglubiyet>0</Maglubiyet>
    <AtilanGol>0</AtilanGol>
    <YenilenGol>0</YenilenGol>
    <Futbolcular>
      <TakimKodu>0</TakimKodu>
      <FormaNumarasi>0</FormaNumarasi>
      <AdSoyad>AdSoyad</AdSoyad>
      <GolSayisi>0</GolSayisi>
    </Futbolcular>
    <Futbolcular>
      <TakimKodu>0</TakimKodu>
      <FormaNumarasi>0</FormaNumarasi>
      <AdSoyad>AdSoyad</AdSoyad>
      <GolSayisi>0</GolSayisi>
    </Futbolcular>
    <Futbolcular>
      <TakimKodu>0</TakimKodu>
      <FormaNumarasi>0</FormaNumarasi>
      <AdSoyad>AdSoyad</AdSoyad>
      <GolSayisi>0</GolSayisi>
    </Futbolcular>
    <Futbolcular>
      <TakimKodu>0</TakimKodu>
      <FormaNumarasi>0</FormaNumarasi>
      <AdSoyad>AdSoyad</AdSoyad>
      <GolSayisi>0</GolSayisi>
    </Futbolcular>
    <Futbolcular>
      <TakimKodu>0</TakimKodu>
      <FormaNumarasi>0</FormaNumarasi>
      <AdSoyad>AdSoyad</AdSoyad>
      <GolSayisi>0</GolSayisi>
    </Futbolcular>
    <Futbolcular>
      <TakimKodu>0</TakimKodu>
      <FormaNumarasi>0</FormaNumarasi>
      <AdSoyad>AdSoyad</AdSoyad>
      <GolSayisi>0</GolSayisi>
    </Futbolcular>
    <Futbolcular>
      <TakimKodu>0</TakimKodu>
      <FormaNumarasi>0</FormaNumarasi>
      <AdSoyad>AdSoyad</AdSoyad>
      <GolSayisi>0</GolSayisi>
    </Futbolcular>
    <Futbolcular>
      <TakimKodu>0</TakimKodu>
      <FormaNumarasi>0</FormaNumarasi>
      <AdSoyad>AdSoyad</AdSoyad>
      <GolSayisi>0</GolSayisi>
    </Futbolcular>
    <Futbolcular>
      <TakimKodu>0</TakimKodu>
      <FormaNumarasi>0</FormaNumarasi>
      <AdSoyad>AdSoyad</AdSoyad>
      <GolSayisi>0</GolSayisi>
    </Futbolcular>
    <Futbolcular>
      <TakimKodu>0</TakimKodu>
      <FormaNumarasi>0</FormaNumarasi>
      <AdSoyad>AdSoyad</AdSoyad>
      <GolSayisi>0</GolSayisi>
    </Futbolcular>
    <Futbolcular>
      <TakimKodu>0</TakimKodu>
      <FormaNumarasi>0</FormaNumarasi>
      <AdSoyad>AdSoyad</AdSoyad>
      <GolSayisi>0</GolSayisi>
    </Futbolcular>
  </MisafirTak覺m>
  <EvSahibiAtilanGol>0</EvSahibiAtilanGol>
  <MisafirAtilanGol>0</MisafirAtilanGol>
</tns:Karsilasma>
